"title","description","audience_fit","content_type"
"Organic Search (SEO)","Target high-intent keywords like 'BMI calculator', 'TDEE calculator', and 'how many calories should I eat'. Optimize each calculator page with schema markup, unique meta descriptions, and supporting blog content explaining the results. Internal linking between related calculators boosts both SEO and session depth.","People actively searching for health answers — dieters, fitness beginners, pregnant women, athletes tracking macros","Individual calculator landing pages, explanatory blog posts, FAQ schema, how-to guides interpreting results"
"Pinterest","Treat it as a visual search engine. Pin infographics that show sample calculator results, ideal weight ranges, macro splits, or heart rate zones. Pins have a multi-year discovery lifespan and health captures roughly 28% of Pinterest audience interest.","Predominantly women aged 25-45 interested in weight loss, nutrition, pregnancy, and wellness lifestyle","Infographics with calculator outputs, before/after result visuals, step-by-step how-to pins, pinnable tip cards linking back to calculators"
"Short-Form Video (TikTok and Instagram Reels)","Create 15-30 second videos demonstrating how to use a calculator, interpreting surprising results, or debunking myths using calculator data. Hook viewers in the first 2 seconds with a striking stat or relatable scenario. Micro-influencer partnerships with fitness creators drive authentic reach.","Gen Z and Millennials aged 18-35 focused on body composition, fitness goals, and nutrition","Screen-recorded calculator walkthroughs, reaction videos to calculator results, myth-busting clips, influencer result reveals"
"YouTube","Produce longer explainer videos on topics like 'How to calculate your TDEE and set calories' or 'What your BMI actually means'. Rank for health and fitness search queries on the second-largest search engine. Link the relevant calculator in every video description.","Fitness enthusiasts, people starting a diet or training program, health-curious audiences aged 20-45","Tutorial videos, educational explainers, 'I tried eating at my TDEE for 30 days' style content, calculator comparison videos"
"Reddit Community Participation","Engage authentically in subreddits like r/Fitness (10M+ members), r/loseit, r/BabyBumps, r/PCOS, and r/xxfitness. Answer questions with helpful context and reference the calculator as a resource rather than advertising. Healthcare is Reddit's fastest-growing organic category with 48% YoY growth.","High-intent users seeking peer advice on specific health decisions — weight loss, pregnancy, macro tracking, training","Direct helpful replies, AMA participation, resource round-up posts, sharing calculator links only when directly relevant"
"Fitness and Health Influencer Partnerships","Offer fitness bloggers, personal trainers, and dietitian creators an embeddable version of your calculator or a co-branded resource page. Contextual backlinks from authority health sites drive both referral traffic and domain authority. Tool-based content like calculators earns links organically.","Followers of niche fitness and nutrition creators — macro trackers, keto dieters, pregnant women, endurance athletes","Embedded calculator widgets on partner sites, sponsored blog posts with calculator walkthroughs, affiliate or co-branded landing pages"
"Email Marketing and Newsletter Syndication","Build a subscriber list by offering a free personalized results summary or a downloadable meal plan based on calculator output. Partner with health and wellness newsletters for sponsored placements that link directly to relevant calculators. Segment by calculator type for targeted follow-up content.","Existing users who engaged with a calculator and opted in, plus wellness newsletter audiences","Welcome sequences with result interpretation tips, weekly health tip emails with calculator CTAs, re-engagement flows tied to goal milestones"
"Answer Engine and AI Search Optimization","Structure calculator result pages and blog content to answer specific questions directly, targeting featured snippets and AI-generated answer citations. Google's AI Overviews and ChatGPT increasingly cite authoritative health tools. Use clear headings, concise definitions, and structured data to be cited.","Anyone using Google, Bing, or AI assistants to ask direct health questions like 'what is a healthy BMI for my height'","Structured FAQ sections on calculator pages, definition pages for health metrics, concise result explanation paragraphs with schema markup"
